{
  "$schema": "./schemas/tinyland-repo-manifest.schema.json",
  "schema_version": 1,
  "repo": {
    "name": "ci-templates",
    "github": "tinyland-inc/ci-templates",
    "description": "Reusable GitHub Actions composites and workflows for Tinyland CI, GitOps lanes, and Flywheel Bazel wiring.",
    "linear": {
      "initiative": "TIN-1433",
      "issue": "TIN-1581"
    }
  },
  "taxonomy": {
    "primary_role": "ci-template-library",
    "layers": [
      "org-wide-repo-contract",
      "ci-template-library",
      "bazel-package-cache-rbe"
    ]
  },
  "contracts": {
    "agent_contract": "README.md and RELEASING.md",
    "just": "Justfile",
    "nix": "flake.nix",
    "github_actions": ".github/actions and .github/workflows",
    "secrets_scan": "gitleaks",
    "conformance": "just check"
  },
  "boundaries": {
    "owns_runtime_backend": false,
    "owns_auth": false,
    "owns_payments": false,
    "owns_activitypub_delivery": false,
    "owns_live_broker_fetch": false,
    "owns_static_projection_ingest": false,
    "owns_gitops_apply": false,
    "owns_cloudflare_mutation": false,
    "owns_bazel_module_authority": false
  },
  "authorities": {
    "content_authority": "tinyland.dev",
    "ci_templates": "tinyland-inc/ci-templates",
    "cache_rbe_authority": "tinyland-inc/GloriousFlywheel",
    "tofu_module_authority": "tinyland-inc/GloriousFlywheel",
    "package_registry": "tinyland-inc/bazel-registry"
  },
  "enrollment": {
    "forgeScope": "tinyland-inc",
    "operatorOverlay": "tinyland-infra",
    "substrateMode": "compatibility-local-only"
  },
  "supply_chain": {
    "sbom": {
      "status": "not-required",
      "formats": [],
      "notes": "This repository publishes workflow and composite-action source rather than application artifacts."
    }
  }
}
